<?xml version="1.0" encoding="UTF-8"?>
<!DOCTYPE oval PUBLIC 
   "-//OVal/OVal Configuration DTD 0.8//EN"
   "http://oval.sourceforge.net/oval-configuration-0.8.dtd">
<oval>
	<!-- define a constraint set -->
	<constraintSet id="user.userid">
		<net.sf.oval.constraints.NotNullCheck message="{0} is null" />
		<net.sf.oval.constraints.RegExCheck message="{0} does not match the pattern {2}">
			<pattern pattern="^[a-z0-9]{8}$" flags="0" />
		</net.sf.oval.constraints.RegExCheck>
	</constraintSet>

	<!-- define checks for the net.sf.oval.test.enforcer.XMLConfigurationTest$User class -->
	<!-- overwrite=false means already defined checks for this class will not be removed -->
	<class type="net.sf.oval.test.enforcer.XMLConfigurationTest$User" overwrite="false"
		applyFieldConstraintsToSetter="true">
		<field name="firstName">
			<net.sf.oval.constraints.LengthCheck min="0" max="3"
				message="{0} is not between {2} and {3} characters long" />
		</field>

		<field name="lastName">
			<net.sf.oval.constraints.LengthCheck min="0" max="5"
				message="{0} is not between {2} and {3} characters long" />
		</field>

		<!-- overwrite=true means previously defined checks for this field will be overwritten by the checks defined here -->
		<field name="userId" overwrite="true">
			<!-- use the checks defined for the constaint set "user.userid" -->
			<net.sf.oval.constraints.AssertConstraintSetCheck id="user.userid" />
		</field>

		<!-- define constructor parameter checks -->
		<constructor>
			<!-- parameter 1 -->
			<parameter type="java.lang.String">
				<net.sf.oval.constraints.AssertConstraintSetCheck id="user.userid" />
			</parameter>

			<!-- parameter 2 -->
			<parameter type="java.lang.String">
				<net.sf.oval.constraints.AssertConstraintSetCheck id="user.userid" />
			</parameter>

			<!-- parameter 3 -->
			<!-- the types of all parameters must be listed, even if no checks are defined -->
			<parameter type="int" />
		</constructor>

		<!-- define a getter return value check -->
		<method name="getManagerId">
			<!-- returnValue -  use the checks defined for the constaint set "user.userid" -->
			<returnValue>
				<net.sf.oval.constraints.AssertConstraintSetCheck id="user.userid" />
			</returnValue>
		</method>

		<!-- define method parameter checks -->
		<method name="setManagerId">
			<!-- parameter 1 -->
			<parameter type="java.lang.String">
				<net.sf.oval.constraints.AssertConstraintSetCheck id="user.userid" />
			</parameter>
		</method>
	</class>
</oval>